{
  "schema_version": "1.0.0",
  "study_id": "live-sensor-v1-manual-only",
  "status": "frozen-before-outer-results",
  "dataset_firewall": {
    "mode": "manual_only",
    "allowed_archive_ids": ["manual"],
    "allowed_archive_filenames": ["Manual Calibration (2).zip"],
    "forbidden_archive_filenames": ["Auto Calibration.zip"],
    "reject_derived_lineage": true
  },
  "sources": {
    "manual": {
      "archive_path": "C:/Users/DLSU/Downloads/THESIS DATA/Data Collection/Manual Calibration (2).zip",
      "archive_role": "model_primary",
      "expected_sha256": "e039dcd49f3390d34dc979490dcf46a6ecc43d9e6a2aec08e4952acc14b5006a",
      "expected_session_count": 83,
      "primary_test_groups": ["TEST1", "TEST2", "TEST3", "TEST4", "TEST5", "TEST6"]
    }
  },
  "paths": {
    "roi_layout": "assets/live_sensor/roi_layout.json",
    "analysis_root": "analysis_outputs/live_sensor_manual_only",
    "cache_root": "analysis_outputs/live_sensor_manual_only/cache",
    "feature_store_root": "analysis_outputs/live_sensor_manual_only/feature_store",
    "source_inventory_root": "analysis_outputs/live_sensor_manual_only/source_inventory",
    "split_root": "analysis_outputs/live_sensor_manual_only/splits",
    "model_run_root": "analysis_outputs/live_sensor_manual_only/model_runs",
    "figure_root": "analysis_outputs/live_sensor_manual_only/figures",
    "run_manifest_root": "analysis_outputs/live_sensor_manual_only/run_manifests"
  },
  "frame_contract": {
    "raw_width": 640,
    "raw_height": 480,
    "oriented_width": 480,
    "oriented_height": 640,
    "rotation_degrees_clockwise": 90,
    "mirror_horizontal_after_rotation": true,
    "color_input": "BGR_uint8",
    "quantitative_channel": "OpenCV_HSV_V",
    "quantitative_video_member": "session_video.mp4"
  },
  "feature_contract": {
    "version": "optical-v1-signed-positive",
    "baseline_statistic": "per_pixel_median_v",
    "signed_delta_formula": "current_v - baseline_median_v",
    "positive_delta_formula": "max(current_v - baseline_median_v, 0)",
    "force_input_order": ["roi1_light", "roi2_light", "roi3_light", "roi4_light", "roi5_light", "roi6_light", "roi7_light", "roi8_light", "roi9_light"],
    "global_fit_values_forbidden_in_feature_store": ["no_contact_floor", "response_scale", "contact_threshold", "imputation", "fdetect", "fmax", "model_transform"]
  },
  "force_study": {
    "nominal_min_N": 0.0,
    "nominal_max_N": 3.0,
    "force_bin_width_N": 0.25,
    "minimum_sessions_per_bin": 3,
    "plateau_initial_force_max_N": 1.0,
    "plateau_sensitivity_fraction": 0.2,
    "plateau_consecutive_bins": 3,
    "safe_limit_fraction_below_knee": 0.9,
    "lag_search_ms": {"minimum": 0, "maximum": 500, "step": 10},
    "lag_tie_relative_tolerance": 0.005,
    "no_contact_frame_fpr_target": 0.05,
    "outer_group_field": "test_group",
    "outer_groups": ["TEST1", "TEST2", "TEST3", "TEST4", "TEST5", "TEST6"],
    "inner_group_folds": 5,
    "support_envelope_quantiles": [0.001, 0.999],
    "support_margin_options": [0.0, 0.05, 0.1],
    "support_distance_quantiles": [0.99, 0.995, 0.999],
    "support_max_samples_per_stratum": 200
  },
  "candidates": {
    "force": ["total_light_zero_intercept", "nnls", "positive_ridge", "positive_elastic_net", "isotonic_total_light", "monotonic_piecewise", "monotonic_hist_gradient_boosting", "monotonic_xgboost", "rbf_svr_benchmark", "extra_trees_benchmark", "small_mlp_benchmark"],
    "localization": ["normalized_argmax", "multinomial_logistic", "knn", "rbf_svc", "random_forest", "extra_trees", "hist_gradient_boosting", "xgboost", "small_mlp"],
    "maximum_tuning_trials_per_candidate": 40
  },
  "seeds": [1729, 8675309, 20260813],
  "runtime": {
    "contact_debounce_frames": 2,
    "roi_switch_debounce_frames": 2,
    "stale_timeout_floor_ms": 500,
    "newest_only_inference_queue_size": 1,
    "load_cell_use": "validation_reference_only"
  }
}
